{
  "schemaVersion": 1,
  "verifiedOn": "2026-08-29",
  "partProfiles": {
    "lg-lt1000p": {
      "componentId": "water-filter",
      "name": "LT1000P refrigerator water filter",
      "sku": "LT1000P",
      "location": "Inside the fresh-food compartment; follow the exact model instructions",
      "installBoundary": "user-replaceable",
      "commerceQuery": "LG LT1000P refrigerator water filter exact part",
      "offerCountAtVerification": 5,
      "identitySource": {
        "id": "lg-lt1000p-identity-2026-08-29",
        "kind": "manufacturer-part",
        "title": "LG LT1000P genuine replacement water-filter page",
        "url": "https://www.lg.com/us/appliances-accessories/lg-lt1000p-refrigerator-water-filter",
        "publisher": "LG",
        "appliesTo": "LG LT1000P genuine replacement filter; model fit is established separately"
      }
    },
    "samsung-da97-17376b": {
      "componentId": "water-filter",
      "name": "HAF-QIN refrigerator water filter",
      "sku": "DA97-17376B",
      "location": "Inside the refrigerator; follow the exact model instructions",
      "installBoundary": "user-replaceable",
      "commerceQuery": "Samsung HAF-QIN DA97-17376B refrigerator water filter exact part",
      "offerCountAtVerification": 5,
      "identitySource": {
        "id": "samsung-da97-17376b-identity-2026-08-29",
        "kind": "manufacturer-part",
        "title": "Samsung HAF-QIN genuine refrigerator water filter",
        "url": "https://www.samsung.com/us/home-appliance-accessories/haf-qin-refrigerator-water-filter-sku-haf-qin-exp/",
        "publisher": "Samsung",
        "appliesTo": "Samsung HAF-QIN/EXP manufacturer part DA97-17376B; exact refrigerator fit is established separately"
      }
    },
    "bosch-11032531": {
      "componentId": "water-filter",
      "name": "UltraClarity Pro refrigerator water filter",
      "sku": "11032531",
      "location": "Inside the fresh-food compartment; follow the exact E-Nr instructions",
      "installBoundary": "user-replaceable",
      "commerceQuery": "Bosch 11032531 UltraClarity Pro water filter exact part",
      "offerCountAtVerification": 5,
      "identitySource": {
        "id": "bosch-11032531-identity-2026-08-29",
        "kind": "manufacturer-part",
        "title": "Bosch 11032531 UltraClarity Pro water filter",
        "url": "https://www.bosch-home.com/us/en/product/11032531",
        "publisher": "Bosch",
        "appliesTo": "Bosch part 11032531 / BORPLFTR55; exact E-Nr fit is established separately"
      }
    },
    "bosch-00631200": {
      "componentId": "drain-pump",
      "name": "Bosch dishwasher drain pump",
      "sku": "00631200",
      "location": "Internal drain pump below the tub; diagnosis stops before disassembly",
      "installBoundary": "professional-only",
      "commerceQuery": "Bosch 00631200 dishwasher drain pump exact part",
      "offerCountAtVerification": 5,
      "identitySource": {
        "id": "bosch-00631200-identity-2026-08-29",
        "kind": "manufacturer-part",
        "title": "Bosch 00631200 Pump-drain product page",
        "url": "https://www.bosch-home.com/us/en/product/00631200",
        "publisher": "Bosch",
        "appliesTo": "Bosch manufacturer drain pump 00631200; exact E-Nr fit is established separately"
      }
    },
    "samsung-dd81-02635a": {
      "componentId": "drain-pump",
      "name": "Samsung dishwasher drain pump",
      "sku": "DD81-02635A",
      "location": "Internal drain pump below the tub; diagnosis stops before disassembly",
      "installBoundary": "professional-only",
      "commerceQuery": "Samsung DD81-02635A dishwasher drain pump exact part",
      "offerCountAtVerification": 5,
      "identitySource": {
        "id": "samsung-dd81-02635a-identity-2026-08-29",
        "kind": "authorized-parts",
        "title": "Samsung-authorized Encompass DD81-02635A drain-pump page",
        "url": "https://encompass.com/item/12313027/Samsung/DD81-02635A/",
        "publisher": "Encompass",
        "appliesTo": "Samsung drain pump DD81-02635A; exact appliance fit is established on authorized model pages"
      }
    },
    "samsung-dd31-00016a": {
      "componentId": "drain-pump",
      "name": "Samsung dishwasher drain pump motor",
      "sku": "DD31-00016A",
      "location": "Internal drain pump below the tub; diagnosis stops before disassembly",
      "installBoundary": "professional-only",
      "commerceQuery": "Samsung DD31-00016A dishwasher drain pump exact part",
      "offerCountAtVerification": 5,
      "identitySource": {
        "id": "samsung-dd31-00016a-identity-2026-08-29",
        "kind": "authorized-parts",
        "title": "Samsung-authorized Encompass DD31-00016A drain-pump page",
        "url": "https://encompass.com/item/10161536/Samsung/DD31-00016A/",
        "publisher": "Encompass",
        "appliesTo": "Samsung dishwasher drain pump DD31-00016A; exact appliance fit is established separately"
      }
    },
    "everydrop-edr1rxd1": {
      "componentId": "water-filter",
      "name": "EveryDrop Filter 1 refrigerator water filter",
      "sku": "EDR1RXD1",
      "location": "Inside the refrigerator; follow the exact model instructions",
      "installBoundary": "user-replaceable",
      "commerceQuery": "Whirlpool EveryDrop EDR1RXD1 refrigerator water filter exact part",
      "offerCountAtVerification": 5,
      "identitySource": {
        "id": "everydrop-edr1rxd1-identity-2026-08-29",
        "kind": "manufacturer-part",
        "title": "Whirlpool-family owner documentation naming EDR1RXD1",
        "url": "https://www.amana.com/content/dam/global/documents/202406/owners-manual-w11484052-revE.pdf",
        "publisher": "Whirlpool Corporation",
        "appliesTo": "EveryDrop Filter 1 manufacturer part EDR1RXD1; exact appliance fit is established separately"
      }
    },
    "everydrop-edr4rxd1": {
      "componentId": "water-filter",
      "name": "EveryDrop Filter 4 refrigerator water filter",
      "sku": "EDR4RXD1",
      "location": "Inside the fresh-food compartment; follow the exact model instructions",
      "installBoundary": "user-replaceable",
      "commerceQuery": "Whirlpool EveryDrop EDR4RXD1 refrigerator water filter exact part",
      "offerCountAtVerification": 5,
      "identitySource": {
        "id": "everydrop-edr4rxd1-identity-2026-08-29",
        "kind": "manufacturer-part",
        "title": "Whirlpool EveryDrop Filter 4 EDR4RXD1 product page",
        "url": "https://www.whirlpool.com/accessories/kitchen-accessories/refrigerator/p.everydrop-refrigerator-water-filter-4-edr4rxd1.html",
        "publisher": "Whirlpool",
        "appliesTo": "EveryDrop Filter 4 manufacturer part EDR4RXD1; exact appliance fit is established separately"
      }
    },
    "ge-xwfe": {
      "componentId": "water-filter",
      "name": "XWFE refrigerator water filter",
      "sku": "XWFE",
      "location": "Inside the fresh-food compartment; follow the exact model instructions",
      "installBoundary": "user-replaceable",
      "commerceQuery": "GE XWFE refrigerator water filter exact part",
      "offerCountAtVerification": 5,
      "identitySource": {
        "id": "ge-xwfe-identity-2026-08-29",
        "kind": "manufacturer-part",
        "title": "GE XWFE refrigerator water filter",
        "url": "https://www.geapplianceparts.com/store/parts/spec/XWFE",
        "publisher": "GE Appliances",
        "appliesTo": "GE manufacturer part XWFE; exact appliance fit is established separately"
      }
    }
  },
  "records": [
    {
      "modelId": "lg-lfxs26973s",
      "exactCode": "LFXS26973S.ASTCNA2",
      "partProfile": "lg-lt1000p",
      "compatibilitySources": [
        {
          "id": "lg-lfxs26973s-lt1000p",
          "kind": "manufacturer-part",
          "title": "LG LFXS26973S specifications naming the LT1000P filter",
          "url": "https://www.lg.com/us/business/refrigerators/lg-lfxs26973s",
          "publisher": "LG",
          "appliesTo": "LG LFXS26973S.ASTCNA2"
        },
        {
          "id": "lg-lfxs26973s-astcna2-support",
          "kind": "manufacturer-part",
          "title": "LG exact-revision support page",
          "url": "https://www.lg.com/us/support/product/lg-LFXS26973S.ASTCNA2",
          "publisher": "LG",
          "appliesTo": "LG LFXS26973S.ASTCNA2"
        }
      ]
    },
    {
      "modelId": "lg-lmxs28626s",
      "exactCode": "LMXS28626S.ASTCNA1",
      "partProfile": "lg-lt1000p",
      "compatibilitySources": [
        {
          "id": "lg-lmxs28626s-lt1000p",
          "kind": "manufacturer-part",
          "title": "LG LMXS28626S specifications naming the LT1000P filter",
          "url": "https://www.lg.com/us/refrigerators/lg-lmxs28626s-french-4-door-refrigerator",
          "publisher": "LG",
          "appliesTo": "LG LMXS28626S.ASTCNA1"
        },
        {
          "id": "lg-lmxs28626s-astcna1-support",
          "kind": "manufacturer-part",
          "title": "LG exact-revision support page",
          "url": "https://www.lg.com/us/support/product/lg-LMXS28626S.ASTCNA1",
          "publisher": "LG",
          "appliesTo": "LG LMXS28626S.ASTCNA1"
        }
      ]
    },
    {
      "modelId": "lg-lrfws2906s",
      "exactCode": "LRFWS2906S.ASTCNA1",
      "partProfile": "lg-lt1000p",
      "compatibilitySources": [
        {
          "id": "lg-lrfws2906s-lt1000p",
          "kind": "manufacturer-part",
          "title": "LG LRFWS2906S specifications naming the LT1000P filter",
          "url": "https://www.lg.com/us/business/refrigerators/lg-lrfws2906s",
          "publisher": "LG",
          "appliesTo": "LG LRFWS2906S.ASTCNA1"
        },
        {
          "id": "lg-lrfws2906s-astcna1-support",
          "kind": "manufacturer-part",
          "title": "LG exact-revision support page",
          "url": "https://www.lg.com/us/support/product/lg-LRFWS2906S.ASTCNA1",
          "publisher": "LG",
          "appliesTo": "LG LRFWS2906S.ASTCNA1"
        }
      ]